{
  "schema": 1,
  "kind": "maui-preview-qualification",
  "contractVersion": "preview-qualification-v1",
  "generatedAt": "1970-01-01T00:00:00+00:00",
  "status": "not-qualified",
  "platform": "android",
  "fingerprints": {
    "corpusVersion": "sha256:0547cf42d68c5a03b71b1906a3216f6f4a2ce71d7738f2b479c8453d353fbc4e",
    "corpusFingerprint": "sha256:0c98d5eacd1f7cbaf9cb476dec8293da52166336fb71edb01147a9d1f6742a51",
    "repositoryCommit": "unknown",
    "testingPackageVersion": "sha256:3f4f626fe7078b33a46be0b16dcf0ae64a42af70e61c6d888828c41a4425bace",
    "packageId": "unknown",
    "packageFingerprint": "unknown",
    "toolVersion": "sha256:3f4f626fe7078b33a46be0b16dcf0ae64a42af70e61c6d888828c41a4425bace",
    "toolFingerprint": "unknown",
    "policyVersion": "sha256:9023e2e4bd34546ad1d27b8e65fb836a6ae291fce9e3c72557ac1f0ed5f7eb08",
    "policyFingerprint": "unknown"
  },
  "profiles": [
    {
      "platform": "android",
      "scope": "sha256:38858b53d6c1ff0eb5efcaab799181bdc46d0fef1c927399d460afaca46c4ed3",
      "deviceEvidenceKind": "none",
      "realDevice": false,
      "deviceFingerprint": "unknown",
      "runtimeFingerprint": "unknown",
      "buildFingerprint": "unknown",
      "packageFingerprint": "unknown",
      "seedFingerprint": "unknown",
      "backendStateFingerprint": "unknown",
      "firstAttemptMode": "sha256:54cf65ea9a66edaa2ded1499273cd3e87cde7033719843042fe588d5613943f7"
    }
  ],
  "featureFlags": {
    "schema": 1,
    "policyVersion": "preview-flags-v1",
    "workbenchEnabled": false,
    "agentAuthoringEnabled": false,
    "repairProposalsEnabled": false,
    "sourceProposalsEnabled": false,
    "traceImportExportEnabled": false,
    "autoApplyRepair": false,
    "autoApplySource": false,
    "modelProviderEnabled": false,
    "telemetryEgressEnabled": false,
    "requiredPullRequestGate": false,
    "killSwitches": []
  },
  "review": {
    "planId": "unknown",
    "planReviewStatus": "missing",
    "rubberDuckReviewStatus": "missing",
    "independentReviewStatus": "missing",
    "reviewerFingerprints": [],
    "artifactRefs": []
  },
  "corpus": {
    "version": "sha256:0547cf42d68c5a03b71b1906a3216f6f4a2ce71d7738f2b479c8453d353fbc4e",
    "manifestFingerprint": "sha256:0c98d5eacd1f7cbaf9cb476dec8293da52166336fb71edb01147a9d1f6742a51",
    "staticOnly": true,
    "manifestValid": true,
    "caseSchemaValid": true,
    "curatedCases": 58,
    "generatedCases": 300,
    "deviceBackedCases": 0,
    "curatedRepairPositiveCases": 31,
    "curatedDerivedCases": 30,
    "curatedNoRepairCases": 16,
    "generatedNoRepairCases": 300,
    "curatedClassificationLabeledCases": 45,
    "provenanceComplete": true,
    "provenanceSourceCounts": [
      {
        "sourceKind": "synthetic",
        "count": 58
      }
    ],
    "mutationSeed": 20260802,
    "generatorVersion": "sha256:39b35a7028472dc4f4400b6ffe9e1b3e3e7b5e65a64008f98a0a5396cb9e540e",
    "errors": [],
    "securityCorpus": {
      "version": "sha256:7420b08a19ac73c2ad94a07f52442bd1a5f28936e9db61fa67f68c36cdea844a",
      "manifestFingerprint": "sha256:e5a89d607aac0c8e5806f1433ae1a742d1a492f1c63b3dfcb643f5862f1dc0cc",
      "valid": true,
      "caseCount": 18,
      "passedCount": 18,
      "caseIds": [
        "sha256:69472384cea460340e50f5c41c837c8a2412901570d0c7e777469f18ba38e00a",
        "sha256:849a7577fb1b0edd17a476ea4d75440b17f6ba695864e101e6a27ac470f3af53",
        "sha256:4f4d7aa0c5c2a651bd6ba725cdec2e08b3e7324c8cab11b9376592725c5fba07",
        "sha256:a47112d4879ef758770e242111d9260971ad8ea16824158524d8068677844b79",
        "sha256:04f44463088ab45f04671ba3d7d710d0f04ef5c40a0002dc0fb24efdede6244e",
        "sha256:e8fd8f58d62af6d4c8722fe6704b79d2d3d74922386e2e4462c479cf8991e6f7",
        "sha256:046ea924d8c205ade42030460affca95ef4c66ff4bfac82a74cb9d015ef63d40",
        "sha256:1ef6fd4b0d2fbd1c408f0c386de3d2b435f624a3ea6a27653a48133e64735b4c",
        "sha256:b97fea4c6cd3f21a832c4e2b774deaf7c6d60cdb61d5cd5ef03a3f8cd0de6383",
        "sha256:039b608517da5d269cdf89a66a44c5e519d90b4b5f0708201abf64c721850e9b",
        "sha256:18fd29fe50b1b3d9c6e1d2c08dcb2630a4220f239da5ddbe38319ff9cc1c1a90",
        "sha256:6f52990c7db54ecb0679256696df0cce6d95a6b1dea8952edfe7421b76a7485d",
        "sha256:5688ad335bff7172fe2fa548e44cf71e805646476644a99afb7856431ef432eb",
        "sha256:cdeda22f7cb08868444def899bfdbf3ea8a2cae116ba9c55dac0e28f8c440f61",
        "sha256:6a17e98e5336a27a14c8d406b7f89dbcd2c7edebc1836c00f023849feb4c7512",
        "sha256:8caa58a26cf46bdce92a8b8b041ec961b0537e50f13d0cfee4744a4251f1a829",
        "sha256:5727fe7fb4c4da1108bf8f964dd1a55e2b68b93dd2e1de28e11929f51e6cd1ce",
        "sha256:2cd7a95dae70de74b97b924c3a03794c9791d2afe23e9818f36d80ad222885bb"
      ],
      "errors": []
    }
  },
  "metrics": {
    "recordingValidity": {
      "state": "missing",
      "numerator": 0,
      "denominator": 0,
      "sampleSources": [],
      "sourceCounts": [],
      "independentEvaluations": 0,
      "independentNumerator": 0,
      "exclusions": []
    },
    "selectorStability": {
      "state": "missing",
      "numerator": 0,
      "denominator": 0,
      "sampleSources": [],
      "sourceCounts": [],
      "independentEvaluations": 0,
      "independentNumerator": 0,
      "exclusions": []
    },
    "repairPrecision": {
      "state": "measured",
      "numerator": 31,
      "denominator": 31,
      "value": 1,
      "confidenceInterval": {
        "method": "wilson-95",
        "confidenceLevel": 0.95,
        "lower": 0.889744604539564,
        "upper": 1
      },
      "sampleSources": [
        "curated",
        "curated-derived"
      ],
      "sourceCounts": [
        {
          "source": "curated",
          "numerator": 1,
          "denominator": 1,
          "independentEvaluations": 1
        },
        {
          "source": "curated-derived",
          "numerator": 30,
          "denominator": 30,
          "independentEvaluations": 0
        }
      ],
      "independentEvaluations": 1,
      "independentNumerator": 1,
      "independentConfidenceInterval": {
        "method": "wilson-95",
        "confidenceLevel": 0.95,
        "lower": 0.20654931437723745,
        "upper": 1
      },
      "independentDeviceRuns": false,
      "exclusions": []
    },
    "repairRecall": {
      "state": "measured",
      "numerator": 31,
      "denominator": 31,
      "value": 1,
      "confidenceInterval": {
        "method": "wilson-95",
        "confidenceLevel": 0.95,
        "lower": 0.889744604539564,
        "upper": 1
      },
      "sampleSources": [
        "curated",
        "curated-derived"
      ],
      "sourceCounts": [
        {
          "source": "curated",
          "numerator": 1,
          "denominator": 1,
          "independentEvaluations": 1
        },
        {
          "source": "curated-derived",
          "numerator": 30,
          "denominator": 30,
          "independentEvaluations": 0
        }
      ],
      "independentEvaluations": 1,
      "independentNumerator": 1,
      "independentConfidenceInterval": {
        "method": "wilson-95",
        "confidenceLevel": 0.95,
        "lower": 0.20654931437723745,
        "upper": 1
      },
      "independentDeviceRuns": false,
      "exclusions": []
    },
    "classificationAccuracy": {
      "state": "measured",
      "numerator": 42,
      "denominator": 45,
      "value": 0.9333333333333333,
      "confidenceInterval": {
        "method": "wilson-95",
        "confidenceLevel": 0.95,
        "lower": 0.8214339803640811,
        "upper": 0.977067967400749
      },
      "sampleSources": [
        "curated",
        "curated-derived"
      ],
      "sourceCounts": [
        {
          "source": "curated",
          "numerator": 12,
          "denominator": 15,
          "independentEvaluations": 8
        },
        {
          "source": "curated-derived",
          "numerator": 30,
          "denominator": 30,
          "independentEvaluations": 0
        }
      ],
      "independentEvaluations": 8,
      "independentNumerator": 8,
      "independentConfidenceInterval": {
        "method": "wilson-95",
        "confidenceLevel": 0.95,
        "lower": 0.6755924351161198,
        "upper": 1
      },
      "independentDeviceRuns": false,
      "exclusions": []
    },
    "classificationMatrix": {
      "state": "measured",
      "method": "expected-versus-observed-failure-class",
      "sampleCount": 45,
      "correct": 42,
      "labelCount": 6,
      "inferredSampleCount": 8,
      "inferredCorrect": 8,
      "stampHonouredSampleCount": 37,
      "stampHonouredCorrect": 34,
      "cells": [
        {
          "expected": "assertion-failed",
          "observed": "assertion-failed",
          "count": 1
        },
        {
          "expected": "locator-ambiguous",
          "observed": "locator-ambiguous",
          "count": 1
        },
        {
          "expected": "locator-ambiguous",
          "observed": "locator-not-found",
          "count": 1
        },
        {
          "expected": "locator-not-found",
          "observed": "locator-not-found",
          "count": 38
        },
        {
          "expected": "precondition-unsatisfied",
          "observed": "locator-not-found",
          "count": 1
        },
        {
          "expected": "route-state-drift",
          "observed": "locator-not-found",
          "count": 1
        },
        {
          "expected": "route-state-drift",
          "observed": "route-state-drift",
          "count": 1
        },
        {
          "expected": "unknown-completion",
          "observed": "unknown-completion",
          "count": 1
        }
      ],
      "perClass": [
        {
          "failureClass": "assertion-failed",
          "support": 1,
          "predicted": 1,
          "correct": 1,
          "precision": 1,
          "recall": 1
        },
        {
          "failureClass": "locator-ambiguous",
          "support": 2,